{
  "schemaVersion": "1.0.0",
  "scenario": "feature",
  "status": "passed",
  "bounded": true,
  "sourceCommits": [
    "8ff903545aad717fd117a0bd66b0cb8730625d1b",
    "54fd535",
    "9057fa0"
  ],
  "events": [
    {
      "sequence": 0,
      "type": "analysis.fanout",
      "outcome": "four-read-only-specialists"
    },
    {
      "sequence": 1,
      "type": "analysis.fanin",
      "outcome": "peak-concurrency-3"
    },
    {
      "sequence": 2,
      "type": "worker.succeeded",
      "outcome": "attempt-1"
    },
    {
      "sequence": 3,
      "type": "verification.completed",
      "outcome": "passed"
    },
    {
      "sequence": 4,
      "type": "goal.completed",
      "outcome": "completed"
    }
  ],
  "assertions": {
    "parallelAnalysis": true,
    "peakConcurrency": 3,
    "isolatedImplementation": true,
    "mandatoryVerification": "passed",
    "goalStatus": "completed",
    "terminalLearningPublications": 1
  },
  "artifacts": [
    "cas://evidence/worker/goal-feature/1/research",
    "cas://evidence/worker/goal-feature/1/architecture",
    "cas://evidence/worker/goal-feature/1/security",
    "cas://evidence/worker/goal-feature/1/test",
    "cas://evidence/verifier/passed"
  ],
  "reproduce": [
    "dotnet run --project tools/LoopPilotRunner"
  ]
}